,Unnamed: 0,title,score,id,url,coms_num,author,upvotes,Unnamed: 0.1,word_count
365,365,vatican warns us bishops denying communion supporters abortion rights,693,n9yt0b,https://www.npr.org/2021/05/11/995796836/vatican-warns-u-s-bishops-about-denying-communion-to-supporters-of-abortion-righ,220,misana123,693,438.0,9
366,366,idf antitank missile fired israel gaza mda reported three people injured attack two critical another serious,74,najghi,https://www.ynetnews.com/article/ryjHD11Yu00,140,Mdk_251,74,441.0,16
367,367,israeli airstrikes gaza kill 20 people including nine children palestinian officials say,49725,n9gqdz,https://www.washingtonpost.com/world/jerusalem-alaqsa-templemount-haramalsharif/2021/05/10/17f29614-b161-11eb-bc96-fdf55de43bef_story.html,10460,Revolutionary_Two542,49725,455.0,12
368,368,least 35 killed gaza israel ramps airstrikes response rocket attacks,28,naflkb,https://www.cnn.com/2021/05/11/middleeast/israel-gaza-airstrikes-rockets-intl/index.html,79,ted__lasso,28,457.0,10
369,369,tesla reportedly boosting engagement regulators china faces scrutiny country,22,nags2e,https://www.cnbc.com/2021/05/03/tesla-is-reportedly-boosting-engagement-with-regulators-in-china.html,3,BuffDisciplineLearn,22,458.0,9
370,370,china used fake news social platforms discredit western reports amid pandemic report finds,2,nas5hf,https://www.abc.net.au/news/2021-05-12/china-misinformation-ifj-report-covid-19/100135016,0,guanaco55,2,465.0,13
371,371,covid serious failures global response report finds,9,nar4ke,https://www.bbc.com/news/world-57085505,2,wiverix,9,470.0,7
372,372,uk economy shrank 15 first quarter,10,naitr6,https://www.bbc.co.uk/news/business-57083394,0,VORTXS,10,472.0,6
373,373,short vaccines nepal faces looming covid crisis,16,nag5yk,https://www.bbc.com/news/world-asia-57055209,1,aConfusedBot,16,473.0,7
374,374,palestinians fire 850 rockets israel killing 5 israelis including 1 child,38,naifkd,https://m.jpost.com/israel-news/four-dead-from-latest-wave-of-rockets-aimed-at-central-israel-667902,140,wapples,38,475.0,11
375,375,forest size france regrown worldwide 20 years study finds,80,nafjpw,https://www.theguardian.com/environment/2021/may/11/forest-size-of-france-regrown-worldwide?CMP=Share_iOSApp_Other,8,BoGaN223,80,477.0,9
376,376,someone help find good funding organization helps patients hospital expenses supporting cause save family affected covid would like forward case right organization family get enough funds manage hospital expenses,0,nas5ul,https://www.ketto.org/fundraiser/my-mother-is-suffering-from-corona-virus-we-need-your-help-to-provide-for-her-treatment-394625,2,Odd-Cause5810,0,488.0,29
377,377,indias covid deaths cross quarter million mark sign peak,31,naj2u6,https://www.reuters.com/world/india/indias-covid-deaths-cross-quarter-million-mark-no-sign-peak-2021-05-12/,4,DavidofSasun,31,491.0,9
378,378,high bmi linked increase risk testing positive covid19 study,18,nakbmt,https://www.standard.co.uk/news/uk/people-israel-italy-b934340.html,12,diacewrb,18,492.0,9
